{
	"id": "gitlabrunner",
	"name": "GitlabRunner",
	"layer": "sovereign-standards",
	"description": {
		"de": "Die Technologie bildet einen verbindlichen Architektur- und Funktionsbaustein innerhalb des D-Stacks. Sie definiert einen organisationsweit gültigen technischen Standard für den Bereich 'CI/CD Pipeline' und dient als Referenz für konsistente, interoperable und wiederverwendbare Implementierungen.",
		"en": ""
	},
	"tags": [],
	"oss": true,
	"sovereigntyCriteria": {
		"openSource": true,
		"euHeadquartered": false,
		"hasAudit": false,
		"permissiveLicense": false,
		"matureProject": false,
		"selfHostable": false,
		"dataPortability": false,
		"openStandards": false,
		"noTelemetryByDefault": false
	}
}
