{
	"id": "verbindliche-integration-des-fim-baukasten-als-systemstandard",
	"name": "Verbindliche Integration des FIM-Baukasten als Systemstandard",
	"layer": "sovereign-standards",
	"description": {
		"de": "Föderales Informationsmanagement (FIM) als verpflichtender Bestandteil neuer Verwaltungssoftware: Leistungsbeschreibungen, Prozessmodelle und Datenfelder werden direkt aus dem FIM-Repository bezogen statt redundant selbst definiert.",
		"en": ""
	},
	"tags": [],
	"oss": true,
	"sovereigntyCriteria": {
		"openSource": true,
		"euHeadquartered": false,
		"hasAudit": false,
		"permissiveLicense": false,
		"matureProject": false,
		"selfHostable": false,
		"dataPortability": false,
		"openStandards": false,
		"noTelemetryByDefault": false
	}
}
