{
	"id": "temporal-io",
	"name": "Temporal",
	"layer": "building-blocks",
	"sublayer": "lowcode",
	"description": {
		"de": "Temporal ist eine moderne Open-Source-Orchestrierungsplattform für codebasierte Workflows in Microservice-Architekturen. Sie übernimmt automatisches State-Management, Wiederaufnahme und Versionierung von langlaufenden Prozessen.",
		"en": "Temporal is a modern open-source orchestration platform for code-based workflows in microservice architectures. It handles automatic state management, resumption and versioning of long-running processes."
	},
	"homepage": "https://temporal.io/",
	"license": "MIT",
	"tags": ["workflow", "orchestration", "microservices"],
	"oss": true,
	"maturity": "incubation",
	"sovereigntyCriteria": {
		"openSource": true,
		"euHeadquartered": false,
		"hasAudit": false,
		"permissiveLicense": true,
		"matureProject": false,
		"selfHostable": true,
		"dataPortability": true,
		"openStandards": true,
		"noTelemetryByDefault": true,
		"ownerType": "corporation"
	}
}
