{
	"id": "podman",
	"name": "Podman",
	"layer": "infrastructure",
	"description": {
		"de": "Die Technologie bildet einen verbindlichen Architektur- und Funktionsbaustein innerhalb des D-Stacks. Sie definiert einen organisationsweit gültigen technischen Standard für den Bereich 'Daemonlose Container Engine' und dient als Referenz für konsistente, interoperable und wiederverwendbare Implementierungen."
	},
	"oss": true,
	"tags": [],
	"sovereigntyCriteria": {
		"openSource": true,
		"euHeadquartered": false,
		"hasAudit": false,
		"permissiveLicense": false,
		"matureProject": false,
		"selfHostable": false,
		"dataPortability": false,
		"openStandards": false,
		"noTelemetryByDefault": false
	}
}
