{
	"id": "argo-workflow",
	"name": "Argo Workflow",
	"layer": "platform",
	"description": {
		"de": "Die Technologie bildet einen verbindlichen Architektur- und Funktionsbaustein innerhalb des D-Stacks. Sie definiert einen organisationsweit gültigen technischen Standard für den Bereich 'Kubernetes Workflow Engine' und dient als Referenz für konsistente, interoperable und wiederverwendbare Implementierungen.",
		"en": ""
	},
	"oss": false,
	"tags": [],
	"sovereigntyCriteria": {
		"openSource": false,
		"euHeadquartered": false,
		"hasAudit": false,
		"permissiveLicense": false,
		"matureProject": false,
		"selfHostable": false,
		"dataPortability": false,
		"openStandards": false,
		"noTelemetryByDefault": false
	}
}
