{
	"id": "osci-xta-soap",
	"name": "OSCI | XTA | SOAP",
	"layer": "infrastructure",
	"description": {
		"de": "Online Services Computer Interface – kurz OSCI – sind Protokollstandards für den sicheren elektronischen Nachrichtenaustausch über das Internet und andere Netze. Sie garantieren Integrität, Authentizität, Vertraulichkeit und Nachweisbarkeit der Daten und ermöglichen ihre medienbruchfreie, effiziente Verarbeitung."
	},
	"oss": true,
	"tags": [],
	"sovereigntyCriteria": {
		"openSource": true,
		"euHeadquartered": true,
		"hasAudit": false,
		"permissiveLicense": false,
		"matureProject": true,
		"selfHostable": true,
		"dataPortability": false,
		"openStandards": true,
		"noTelemetryByDefault": true
	},
	"homepage": "https://www.xoev.de/osci-xta-3355",
	"license": "Proprietary"
}
