{
	"id": "nfs-network-file-system",
	"name": "NFS Network File System",
	"layer": "infrastructure",
	"description": {
		"de": "Die Technologie bildet einen verbindlichen Architektur- und Funktionsbaustein innerhalb des D-Stacks. Sie definiert einen organisationsweit gültigen technischen Standard für den Bereich 'Netzwerk Dateisystem' und dient als Referenz für konsistente, interoperable und wiederverwendbare Implementierungen."
	},
	"oss": false,
	"tags": [],
	"sovereigntyCriteria": {
		"openSource": false,
		"euHeadquartered": false,
		"hasAudit": false,
		"permissiveLicense": false,
		"matureProject": false,
		"selfHostable": false,
		"dataPortability": false,
		"openStandards": false,
		"noTelemetryByDefault": false
	}
}
